{
  "id": "scenario_001",
  "title": "Prepared real multi-camera blind-zone event",
  "duration_seconds": 15,
  "visible_cameras": [
    {
      "id": "cam_01",
      "file": "data/prepared/scenario_001/cam_a.mp4",
      "model_access": true,
      "position": [
        0,
        4
      ],
      "heading_deg": 95,
      "fov_deg": 70
    },
    {
      "id": "cam_02",
      "file": "data/prepared/scenario_001/cam_b.mp4",
      "model_access": true,
      "position": [
        8,
        0
      ],
      "heading_deg": 185,
      "fov_deg": 65
    },
    {
      "id": "cam_03",
      "file": "data/prepared/scenario_001/cam_c.mp4",
      "model_access": true,
      "position": [
        3,
        -5
      ],
      "heading_deg": 20,
      "fov_deg": 80
    }
  ],
  "ground_truth_camera": {
    "id": "cam_gt",
    "file": "data/prepared/scenario_001/hidden_ground_truth.mp4",
    "model_access": false,
    "position": [
      4,
      1
    ],
    "heading_deg": 270,
    "fov_deg": 70
  }
}